Packet: 10          CBUG ID: 10
Summary
  Input     : INJ.2  
  Output    : GigabitEthernet2
  State     : FWD 
  Timestamp
    Start   : 250286721232349 ns (04/18/2024 14:12:09.760574 UTC)
    Stop    : 250286721237846 ns (04/18/2024 14:12:09.760579 UTC)
Path Trace
  Feature: IPV4(Output)
    Input       : internal0/0/rp:0
    Output      : GigabitEthernet2
    Source      : 192.0.2.1
    Destination : 192.0.2.6
    Protocol    : 6 (TCP)
      SrcPort   : 49568
      DstPort   : 8080
  Feature: IPV4_VFR_REFRAG_EXT
    Entry       : Output - 0x8146831c
    Input       : internal0/0/rp:0
    Output      : GigabitEthernet2
    Lapsed time : 111 ns
  Feature: DEBUG_COND_APPLICATION_OUT_CLR_TXT_EXT
     Entry       : Output - 0x81439d64
    Input       : internal0/0/rp:0
    Output      : GigabitEthernet2
    Lapsed time : 33 ns
  Feature: IPV4_OUTPUT_L2_REWRITE_EXT
    Entry       : Output - 0x812c8e3c
    Input       : internal0/0/rp:0
    Output      : GigabitEthernet2
    Lapsed time : 307 ns
  Feature: DEBUG_COND_MAC_EGRESS_EXT
    Entry       : Output - 0x81439d78
    Input       : internal0/0/rp:0
    Output      : GigabitEthernet2
    Lapsed time : 59 ns
  Feature: DEBUG_COND_APPLICATION_OUT_EXT
    Entry       : Output - 0x81439d68
    Input       : internal0/0/rp:0
    Output      : GigabitEthernet2
    Lapsed time : 33 ns
  Feature: IPV4_OUTPUT_FRAG_EXT
    Entry       : Output - 0x814672b8
    Input       : internal0/0/rp:0
    Output      : GigabitEthernet2
     Lapsed time : 51 ns
  Feature: IPV4_OUTPUT_DROP_POLICY_EXT
    Entry       : Output - 0x81470c18
    Input       : internal0/0/rp:0
    Output      : GigabitEthernet2
    Lapsed time : 293 ns
  Feature: DEBUG_COND_OUTPUT_PKT_EXT
    Entry       : Output - 0x81439d7c
    Input       : internal0/0/rp:0
    Output      : GigabitEthernet2
    Lapsed time : 64 ns
  Feature: MARMOT_SPA_D_TRANSMIT_PKT_EXT
    Entry       : Output - 0x8147e7a4
    Input       : internal0/0/rp:0
    Output      : GigabitEthernet2
    Lapsed time : 2511 ns
Packet Copy In
  4500002c 8e260000 ff06a99d c0000201 c0000206 c1a01f90 6a29195a 00000000
  60021020 a2e60000 02040218
  IPv4
    Version             : 4
    Header Length       : 5
    ToS                 : 0x00
     Total Length        : 44
    Identifier          : 0x8e26
    IP Flags            : 0x0
    Frag Offset         : 0
    TTL                 : 255
    Protocol            : 6 (TCP)
    Header Checksum     : 0xa99d
    Source Address      : 192.0.2.1
    Destination Address : 192.0.2.6
  TCP
    Source Port         : 49568
    Destination Port    : 8080
    Sequence Number     : 0x6a29195a
    ACK Number          : 0x00000000
    TCP flags           : 0x6002
    Window              : 0x1020
    Checksum            : 0xa2e6
    Urgent Pointer      : 0x0000
  Decode halted - end of packet copy reached
Packet Copy Out
  00530002 00010053 00010001 08004500 002c8e26 0000ff06 a99dc000 0201c000
  0206c1a0 1f906a29 195a0000 00006002 1020a2e6 00000204 0218
  ARPA
     Destination MAC     : 0053.0002.0001
    Source MAC          : 0053.0001.0001
    Type                : 0x0800 (IPV4)
  IPv4
    Version             : 4
    Header Length       : 5
    ToS                 : 0x00
    Total Length        : 44
    Identifier          : 0x8e26
    IP Flags            : 0x0
    Frag Offset         : 0
    TTL                 : 255
    Protocol            : 6 (TCP)
    Header Checksum     : 0xa99d
    Source Address      : 192.0.2.1
    Destination Address : 192.0.2.6
  TCP
    Source Port         : 49568
    Destination Port    : 8080
    Sequence Number     : 0x6a29195a
    ACK Number          : 0x00000000
    TCP flags           : 0x6002
    Window              : 0x1020
     Checksum            : 0xa2e6
    Urgent Pointer      : 0x0000
  Decode halted - end of packet copy reached