Packet: 4           CBUG ID: 4
Summary
  Input     : GigabitEthernet1
  Output    : GigabitEthernet2
  State     : FWD 
  Timestamp
    Start   : 253050912747482 ns (04/18/2024 14:12:44.810189 UTC)
    Stop    : 253050912795544 ns (04/18/2024 14:12:44.810237 UTC)
Path Trace
  Feature: IPV4(Input)
    Input       : GigabitEthernet1
    Output      : <unknown>
    Source      : 192.0.2.1
    Destination : 192.0.2.6
    Protocol    : 50 (ESP)
  Feature: DEBUG_COND_INPUT_PKT
    Entry       : Input - 0x81439d70
    Input       : GigabitEthernet1
    Output      : <unknown>
    Lapsed time : 174 ns
  Feature: IPV4_INPUT_DST_LOOKUP_ISSUE
    Entry       : Input - 0x814673dc
    Input       : GigabitEthernet1
    Output      : <unknown>
    Lapsed time : 535 ns
  Feature: IPV4_INPUT_ARL_SANITY
    Entry       : Input - 0x8143bd80
    Input       : GigabitEthernet1
    Output      : <unknown>
    Lapsed time : 247 ns
  Feature: IPV4_INPUT_DST_LOOKUP_CONSUME
    Entry       : Input - 0x814673d8
    Input       : GigabitEthernet1
    Output      : <unknown>
    Lapsed time : 301 ns
  Feature: IPV4_INPUT_FOR_US_MARTIAN
    Entry       : Input - 0x814673e4
    Input       : GigabitEthernet1
    Output      : <unknown>
    Lapsed time : 125 ns
  Feature: DEBUG_COND_APPLICATION_IN
    Entry       : Input - 0x81439d60
    Input       : GigabitEthernet1
    Output      : <unknown>
    Lapsed time : 50 ns
  Feature: DEBUG_COND_APPLICATION_IN_CLR_TXT
    Entry       : Input - 0x81439d5c
    Input       : GigabitEthernet1
    Output      : <unknown>
    Lapsed time : 13 ns
  Feature: IPV4_INPUT_LOOKUP_PROCESS
    Entry       : Input - 0x814673f0
    Input       : GigabitEthernet1
    Output      : GigabitEthernet2
    Lapsed time : 730 ns
  Feature: IPV4_INPUT_IPOPTIONS_PROCESS
    Entry       : Input - 0x81467908
    Input       : GigabitEthernet1
    Output      : GigabitEthernet2
    Lapsed time : 127 ns
  Feature: IPV4_INPUT_GOTO_OUTPUT_FEATURE
    Entry       : Input - 0x8143d7f8
    Input       : GigabitEthernet1
    Output      : GigabitEthernet2
    Lapsed time : 683 ns
  Feature: IPV4_VFR_REFRAG
    Entry       : Output - 0x8146831c
    Input       : GigabitEthernet1
    Output      : GigabitEthernet2
    Lapsed time : 210 ns
  Feature: IPV4_OUTPUT_L2_REWRITE
    Entry       : Output - 0x812c8e3c
    Input       : GigabitEthernet1
    Output      : GigabitEthernet2
    Lapsed time : 621 ns
  Feature: IPV4_OUTPUT_FRAG
    Entry       : Output - 0x814672b8
    Input       : GigabitEthernet1
    Output      : GigabitEthernet2
    Lapsed time : 205 ns
  Feature: IPV4_OUTPUT_DROP_POLICY
    Entry       : Output - 0x81470c18
    Input       : GigabitEthernet1
    Output      : GigabitEthernet2
    Lapsed time : 1505 ns
  Feature: MARMOT_SPA_D_TRANSMIT_PKT
    Entry       : Output - 0x8147e7a4
    Input       : GigabitEthernet1
    Output      : GigabitEthernet2
    Lapsed time : 6713 ns
Packet Copy In
  00530002 00010053 00010001 08004500 00881176 0000ff32 25c6c000 0201c000
  020651c3 58870000 00034500 00581176 0000ff2f 25f9c000 0201c000 02060000
  08004500 00402090 0000ff01 2327cb00 7101cb00 71030800 201c208d 00010000
  00000eec 9ac5abcd abcdabcd abcdabcd abcdabcd abcdabcd abcdabcd abcd0000
  00000102 0204c7e0 2aad6f59 8a7a3f06 8e05a2ea 23c7
  ARPA
    Destination MAC     : 0053.0002.0001
    Source MAC          : 0053.0001.0001
    Type                : 0x0800 (IPV4)
  IPv4
    Version             : 4
    Header Length       : 5
    ToS                 : 0x00
    Total Length        : 136
    Identifier          : 0x1176
    IP Flags            : 0x0
    Frag Offset         : 0
    TTL                 : 255
    Protocol            : 50 (ESP)
    Header Checksum     : 0x25c6
    Source Address      : 192.0.2.1
    Destination Address : 192.0.2.6
  ESP
    SPI                 : 0x51c35887
    Sequence Number     : 0x00000003
Packet Copy Out
  00530003 00010053 00020002 08004500 00881176 0000fe32 26c6c000 0201c000
  020651c3 58870000 00034500 00581176 0000ff2f 25f9c000 0201c000 02060000
  08004500 00402090 0000ff01 2327cb00 7101cb00 71030800 201c208d 00010000
  00000eec 9ac5abcd abcdabcd abcdabcd abcdabcd abcdabcd abcdabcd abcd0000
  00000102 0204c7e0 2aad6f59 8a7a3f06 8e05a2ea 23c7
  ARPA
    Destination MAC     : 0053.0003.0001
    Source MAC          : 0053.0002.0002
    Type                : 0x0800 (IPV4)
  IPv4
    Version             : 4
    Header Length       : 5
    ToS                 : 0x00
    Total Length        : 136
    Identifier          : 0x1176
    IP Flags            : 0x0
    Frag Offset         : 0
    TTL                 : 254
    Protocol            : 50 (ESP)
    Header Checksum     : 0x26c6
    Source Address      : 192.0.2.1
    Destination Address : 192.0.2.6
  ESP
    SPI                 : 0x51c35887
    Sequence Number     : 0x00000003