Packet: 10          CBUG ID: 10
Summary
  Input     : GigabitEthernet1
  Output    : GigabitEthernet2
  State     : FWD 
  Timestamp
    Start   : 253076223056299 ns (04/18/2024 14:13:10.120498 UTC)
    Stop    : 253076223080959 ns (04/18/2024 14:13:10.120523 UTC)
Path Trace
  Feature: IPV4(Input)
    Input       : GigabitEthernet1
    Output      : <unknown>
    Source      : 192.0.2.1
    Destination : 192.0.2.6
    Protocol    : 6 (TCP)
      SrcPort   : 46293
      DstPort   : 8080
  Feature: DEBUG_COND_INPUT_PKT
    Entry       : Input - 0x81439d70
    Input       : GigabitEthernet1
    Output      : <unknown>
    Lapsed time : 161 ns
  Feature: IPV4_INPUT_DST_LOOKUP_ISSUE
    Entry       : Input - 0x814673dc
    Input       : GigabitEthernet1
    Output      : <unknown>
    Lapsed time : 269 ns
  Feature: IPV4_INPUT_ARL_SANITY
    Entry       : Input - 0x8143bd80
    Input       : GigabitEthernet1
    Output      : <unknown>
    Lapsed time : 273 ns
  Feature: IPV4_INPUT_DST_LOOKUP_CONSUME
    Entry       : Input - 0x814673d8
    Input       : GigabitEthernet1
    Output      : <unknown>
    Lapsed time : 402 ns
  Feature: IPV4_INPUT_FOR_US_MARTIAN
    Entry       : Input - 0x814673e4
    Input       : GigabitEthernet1
    Output      : <unknown>
    Lapsed time : 67 ns
  Feature: DEBUG_COND_APPLICATION_IN
    Entry       : Input - 0x81439d60
    Input       : GigabitEthernet1
    Output      : <unknown>
    Lapsed time : 36 ns
  Feature: DEBUG_COND_APPLICATION_IN_CLR_TXT
    Entry       : Input - 0x81439d5c
    Input       : GigabitEthernet1
    Output      : <unknown>
    Lapsed time : 12 ns
  Feature: IPV4_INPUT_LOOKUP_PROCESS
    Entry       : Input - 0x814673f0
    Input       : GigabitEthernet1
    Output      : GigabitEthernet2
    Lapsed time : 397 ns
  Feature: IPV4_INPUT_IPOPTIONS_PROCESS
    Entry       : Input - 0x81467908
    Input       : GigabitEthernet1
    Output      : GigabitEthernet2
    Lapsed time : 70 ns
  Feature: IPV4_INPUT_GOTO_OUTPUT_FEATURE
    Entry       : Input - 0x8143d7f8
    Input       : GigabitEthernet1
    Output      : GigabitEthernet2
    Lapsed time : 157 ns
  Feature: IPV4_VFR_REFRAG
    Entry       : Output - 0x8146831c
    Input       : GigabitEthernet1
    Output      : GigabitEthernet2
    Lapsed time : 57 ns
  Feature: IPV4_OUTPUT_L2_REWRITE
    Entry       : Output - 0x812c8e3c
    Input       : GigabitEthernet1
    Output      : GigabitEthernet2
    Lapsed time : 208 ns
  Feature: IPV4_OUTPUT_FRAG
    Entry       : Output - 0x814672b8
    Input       : GigabitEthernet1
    Output      : GigabitEthernet2
    Lapsed time : 90 ns
  Feature: IPV4_OUTPUT_DROP_POLICY
    Entry       : Output - 0x81470c18
    Input       : GigabitEthernet1
    Output      : GigabitEthernet2
    Lapsed time : 554 ns
  Feature: MARMOT_SPA_D_TRANSMIT_PKT
    Entry       : Output - 0x8147e7a4
    Input       : GigabitEthernet1
    Output      : GigabitEthernet2
    Lapsed time : 3779 ns
Packet Copy In
  00530002 00010053 00010001 08004500 002c52ad 0000ff06 e516c000 0201c000
  0206b4d5 1f9030ae 989f0000 00006002 102069e7 00000204 02180000
  ARPA
    Destination MAC     : 0053.0002.0001
    Source MAC          : 0053.0001.0001
    Type                : 0x0800 (IPV4)
  IPv4
    Version             : 4
    Header Length       : 5
    ToS                 : 0x00
    Total Length        : 44
    Identifier          : 0x52ad
    IP Flags            : 0x0
    Frag Offset         : 0
    TTL                 : 255
    Protocol            : 6 (TCP)
    Header Checksum     : 0xe516
    Source Address      : 192.0.2.1
    Destination Address : 192.0.2.6
  TCP
    Source Port         : 46293
    Destination Port    : 8080
    Sequence Number     : 0x30ae989f
    ACK Number          : 0x00000000
    TCP flags           : 0x6002
    Window              : 0x1020
    Checksum            : 0x69e7
    Urgent Pointer      : 0x0000
  Decode halted - unsupported tcp port number
Packet Copy Out
  00530003 00010053 00020002 08004500 002c52ad 0000fe06 e616c000 0201c000
  0206b4d5 1f9030ae 989f0000 00006002 102069e7 00000204 0218
  ARPA
    Destination MAC     : 0053.0003.0001
    Source MAC          : 0053.0002.0002
    Type                : 0x0800 (IPV4)
  IPv4
    Version             : 4
    Header Length       : 5
    ToS                 : 0x00
    Total Length        : 44
    Identifier          : 0x52ad
    IP Flags            : 0x0
    Frag Offset         : 0
    TTL                 : 254
    Protocol            : 6 (TCP)
    Header Checksum     : 0xe616
    Source Address      : 192.0.2.1
    Destination Address : 192.0.2.6
  TCP
    Source Port         : 46293
    Destination Port    : 8080
    Sequence Number     : 0x30ae989f
    ACK Number          : 0x00000000
    TCP flags           : 0x6002
    Window              : 0x1020
    Checksum            : 0x69e7
    Urgent Pointer      : 0x0000
  Decode halted - end of packet copy reached