Packet: 6           CBUG ID: 6
Summary
  Input     : GigabitEthernet1
  Output    : GigabitEthernet2
  State     : FWD 
  Timestamp
    Start   : 253076216600406 ns (04/18/2024 14:13:10.114042 UTC)
    Stop    : 253076216649158 ns (04/18/2024 14:13:10.114091 UTC)
Path Trace
  Feature: IPV4(Input)
    Input       : GigabitEthernet1
    Output      : <unknown>
    Source      : 192.0.2.1
    Destination : 192.0.2.6
    Protocol    : 1 (ICMP)
  Feature: DEBUG_COND_INPUT_PKT
    Entry       : Input - 0x81439d70
    Input       : GigabitEthernet1
    Output      : <unknown>
    Lapsed time : 177 ns
  Feature: IPV4_INPUT_DST_LOOKUP_ISSUE
    Entry       : Input - 0x814673dc
    Input       : GigabitEthernet1
    Output      : <unknown>
    Lapsed time : 1444 ns
  Feature: IPV4_INPUT_ARL_SANITY
    Entry       : Input - 0x8143bd80
    Input       : GigabitEthernet1
    Output      : <unknown>
    Lapsed time : 551 ns
  Feature: IPV4_INPUT_DST_LOOKUP_CONSUME
    Entry       : Input - 0x814673d8
    Input       : GigabitEthernet1
    Output      : <unknown>
    Lapsed time : 298 ns
  Feature: IPV4_INPUT_FOR_US_MARTIAN
    Entry       : Input - 0x814673e4
    Input       : GigabitEthernet1
    Output      : <unknown>
    Lapsed time : 137 ns
  Feature: DEBUG_COND_APPLICATION_IN
    Entry       : Input - 0x81439d60
    Input       : GigabitEthernet1
    Output      : <unknown>
    Lapsed time : 40 ns
  Feature: DEBUG_COND_APPLICATION_IN_CLR_TXT
    Entry       : Input - 0x81439d5c
    Input       : GigabitEthernet1
    Output      : <unknown>
    Lapsed time : 12 ns
  Feature: IPV4_INPUT_LOOKUP_PROCESS
    Entry       : Input - 0x814673f0
    Input       : GigabitEthernet1
    Output      : GigabitEthernet2
    Lapsed time : 797 ns
  Feature: IPV4_INPUT_IPOPTIONS_PROCESS
    Entry       : Input - 0x81467908
    Input       : GigabitEthernet1
    Output      : GigabitEthernet2
    Lapsed time : 141 ns
  Feature: IPV4_INPUT_GOTO_OUTPUT_FEATURE
    Entry       : Input - 0x8143d7f8
    Input       : GigabitEthernet1
    Output      : GigabitEthernet2
    Lapsed time : 509 ns
  Feature: IPV4_VFR_REFRAG
    Entry       : Output - 0x8146831c
    Input       : GigabitEthernet1
    Output      : GigabitEthernet2
    Lapsed time : 195 ns
  Feature: IPV4_OUTPUT_L2_REWRITE
    Entry       : Output - 0x812c8e3c
    Input       : GigabitEthernet1
    Output      : GigabitEthernet2
    Lapsed time : 835 ns
  Feature: IPV4_OUTPUT_FRAG
    Entry       : Output - 0x814672b8
    Input       : GigabitEthernet1
    Output      : GigabitEthernet2
    Lapsed time : 204 ns
  Feature: IPV4_OUTPUT_DROP_POLICY
    Entry       : Output - 0x81470c18
    Input       : GigabitEthernet1
    Output      : GigabitEthernet2
    Lapsed time : 1443 ns
  Feature: MARMOT_SPA_D_TRANSMIT_PKT
    Entry       : Output - 0x8147e7a4
    Input       : GigabitEthernet1
    Output      : GigabitEthernet2
    Lapsed time : 6583 ns
Packet Copy In
  00530002 00010053 00010001 08004500 00402091 0000ff01 1724c000 0201c000
  02060800 fb3c208e 00010000 00000eec fd9cabcd abcdabcd abcdabcd abcdabcd
  abcdabcd abcdabcd abcd0206 c000
  ARPA
    Destination MAC     : 0053.0002.0001
    Source MAC          : 0053.0001.0001
    Type                : 0x0800 (IPV4)
  IPv4
    Version             : 4
    Header Length       : 5
    ToS                 : 0x00
    Total Length        : 64
    Identifier          : 0x2091
    IP Flags            : 0x0
    Frag Offset         : 0
    TTL                 : 255
    Protocol            : 1 (ICMP)
    Header Checksum     : 0x1724
    Source Address      : 192.0.2.1
    Destination Address : 192.0.2.6
  ICMP
    Type                : 8 (Echo)
    Code                : 0 (No Code)
    Checksum            : 0xfb3c
    Identifier          : 0x208e
    Sequence            : 0x0001
Packet Copy Out
  00530003 00010053 00020002 08004500 00402091 0000fe01 1824c000 0201c000
  02060800 fb3c208e 00010000 00000eec fd9cabcd abcdabcd abcdabcd abcdabcd
  abcdabcd abcdabcd abcd0206 c000
  ARPA
    Destination MAC     : 0053.0003.0001
    Source MAC          : 0053.0002.0002
    Type                : 0x0800 (IPV4)
  IPv4
    Version             : 4
    Header Length       : 5
    ToS                 : 0x00
    Total Length        : 64
    Identifier          : 0x2091
    IP Flags            : 0x0
    Frag Offset         : 0
    TTL                 : 254
    Protocol            : 1 (ICMP)
    Header Checksum     : 0x1824
    Source Address      : 192.0.2.1
    Destination Address : 192.0.2.6
  ICMP
    Type                : 8 (Echo)
    Code                : 0 (No Code)
    Checksum            : 0xfb3c
    Identifier          : 0x208e
    Sequence            : 0x0001