Packet: 4           CBUG ID: 4
Summary
  Input     : GigabitEthernet2
  Output    : internal0/0/rp:0
  State     : PUNT 11  (For-us data)
  Timestamp
    Start   : 250577885704361 ns (04/18/2024 14:13:10.5008 UTC)
    Stop    : 250577885723976 ns (04/18/2024 14:13:10.5027 UTC)
Path Trace
  Feature: IPV4(Input)
    Input       : GigabitEthernet2
    Output      : <unknown>
    Source      : 192.0.2.1
    Destination : 192.0.2.6
    Protocol    : 6 (TCP)
      SrcPort   : 46293
      DstPort   : 8080
  Feature: DEBUG_COND_INPUT_PKT
    Entry       : Input - 0x81439d70
    Input       : GigabitEthernet2
    Output      : <unknown>
    Lapsed time : 106 ns
  Feature: IPV4_INPUT_DST_LOOKUP_ISSUE
    Entry       : Input - 0x814673dc
    Input       : GigabitEthernet2
    Output      : <unknown>
    Lapsed time : 345 ns
  Feature: IPV4_INPUT_ARL_SANITY
    Entry       : Input - 0x8143bd80
    Input       : GigabitEthernet2
    Output      : <unknown>
    Lapsed time : 386 ns
  Feature: IPV4_INPUT_DST_LOOKUP_CONSUME
    Entry       : Input - 0x814673d8
    Input       : GigabitEthernet2
    Output      : <unknown>
    Lapsed time : 236 ns
  Feature: IPV4_INPUT_FOR_US_MARTIAN
    Entry       : Input - 0x814673e4
    Input       : GigabitEthernet2
    Output      : <unknown>
    Lapsed time : 6943 ns
  Feature: DEBUG_COND_APPLICATION_IN_EXT
    Entry       : Input - 0x81439d60
    Input       : GigabitEthernet2
    Output      : <unknown>
    Lapsed time : 45 ns
  Feature: DEBUG_COND_APPLICATION_IN_CLR_TXT_EXT
    Entry       : Input - 0x81439d5c
    Input       : GigabitEthernet2
    Output      : <unknown>
    Lapsed time : 13 ns
  Feature: IPV4_INPUT_LOOKUP_PROCESS_EXT
    Entry       : Input - 0x814673f0
    Input       : GigabitEthernet2
    Output      : internal0/0/rp:0
    Lapsed time : 1209 ns
  Feature: IPV4_INPUT_IPOPTIONS_PROCESS_EXT
    Entry       : Input - 0x81467908
    Input       : GigabitEthernet2
    Output      : internal0/0/rp:0
    Lapsed time : 217 ns
  Feature: IPV4_INPUT_GOTO_OUTPUT_FEATURE_EXT
    Entry       : Input - 0x8143d7f8
    Input       : GigabitEthernet2
    Output      : internal0/0/rp:0
    Lapsed time : 798 ns
  Feature: IPV4_INTERNAL_ARL_SANITY_EXT
    Entry       : Output - 0x8143bd88
    Input       : GigabitEthernet2
    Output      : internal0/0/rp:0
    Lapsed time : 78 ns
  Feature: IPV4_VFR_REFRAG_EXT
    Entry       : Output - 0x8146831c
    Input       : GigabitEthernet2
    Output      : internal0/0/rp:0
    Lapsed time : 127 ns
  Feature: IPV4_OUTPUT_DROP_POLICY_EXT
    Entry       : Output - 0x81470c18
    Input       : GigabitEthernet2
    Output      : internal0/0/rp:0
    Lapsed time : 831 ns
  Feature: INTERNAL_TRANSMIT_PKT_EXT
    Entry       : Output - 0x8143a88c
    Input       : GigabitEthernet2
    Output      : internal0/0/rp:0
    Lapsed time : 4817 ns
Packet Copy In
  00530003 00010053 00020002 08004500 002c52ad 0000fe06 e616c000 0201c000
  0206b4d5 1f9030ae 989f0000 00006002 102069e7 00000204 02180000
  ARPA
    Destination MAC     : 0053.0003.0001
    Source MAC          : 0053.0002.0002
    Type                : 0x0800 (IPV4)
  IPv4
    Version             : 4
    Header Length       : 5
    ToS                 : 0x00
    Total Length        : 44
    Identifier          : 0x52ad
    IP Flags            : 0x0
    Frag Offset         : 0
    TTL                 : 254
    Protocol            : 6 (TCP)
    Header Checksum     : 0xe616
    Source Address      : 192.0.2.1
    Destination Address : 192.0.2.6
  TCP
    Source Port         : 46293
    Destination Port    : 8080
    Sequence Number     : 0x30ae989f
    ACK Number          : 0x00000000
    TCP flags           : 0x6002
    Window              : 0x1020
    Checksum            : 0x69e7
    Urgent Pointer      : 0x0000
  Decode halted - unsupported tcp port number
Packet Copy Out
  01010000 000e003a 00820028 20010000 00000000 00000008 00000000 80000b00
  02062281 ff030000 00000000 c084e0e7 00000000 00000004 00040000 00000000
  00ff0300 00000000 00530003 00010053 00020002 08004500 002c52ad 0000fe06
  e616c000 0201c000 0206b4d5 1f9030ae 989f0000 00006002 102069e7 00000204
  0218
  Punt/Inject
    Version             : 1
    Header type         : 1
    QFP ID              : 0
    Epoch               : 0
    Network Start       : 14
    Packet Length       : 58
    Total Length        : 130
    Feature Hdr Length  : 0
    Platform Hdr Length : 40
    Common Hdr Length   : 32
    Linktype            : 1
    QoS Discard Class   : 0
    QoS Group           : 0
    Table ID Hdl        : 0
    PAL Interface Hdl   : 8
    Inject Interface Hdl: 0
    Flags               : 0x8000
    Cause               : 11
    Sub-Cause           : 0
  ARPA
    Destination MAC     : 0053.0003.0001
    Source MAC          : 0053.0002.0002
    Type                : 0x0800 (IPV4)
  IPv4
    Version             : 4
    Header Length       : 5
    ToS                 : 0x00
    Total Length        : 44
    Identifier          : 0x52ad
    IP Flags            : 0x0
    Frag Offset         : 0
    TTL                 : 254
    Protocol            : 6 (TCP)
    Header Checksum     : 0xe616
    Source Address      : 192.0.2.1
    Destination Address : 192.0.2.6
  TCP
    Source Port         : 46293
    Destination Port    : 8080
    Sequence Number     : 0x30ae989f
    ACK Number          : 0x00000000
    TCP flags           : 0x6002
    Window              : 0x1020
    Checksum            : 0x69e7
    Urgent Pointer      : 0x0000
  Decode halted - end of packet copy reached

IOSd Path Flow: Packet: 4    CBUG ID: 4
  Feature: INFRA
  Pkt Direction: IN
    Packet Rcvd From DATAPLANE

  Feature: IP
  Pkt Direction: IN
    Packet Enqueued in IP layer
    Source      : 192.0.2.1
    Destination : 192.0.2.6
    Interface   : GigabitEthernet2

  Feature: IP
  Pkt Direction: IN
  FORWARDED To transport layer 
    Source        : 192.0.2.1 
    Destination   : 192.0.2.6 
    Interface     : GigabitEthernet2

  Feature: TCP
  Pkt Direction: IN
    tcp0: I NoTCB 192.0.2.1:46293 192.0.2.6:8080 seq 816748703 OPTS 4 SYN  WIN 4128


  Feature: TCP
  Pkt Direction: IN
  CONSUMED 
	TCP: Control packet
	ACK         : 0
	SEQ         : 816748703
	Source      : 192.0.2.1(46293)
	Destination : 192.0.2.6(8080)